{
  "id": "jersey-club",
  "name_ko": "저지클럽/볼티모어클럽",
  "name_en": "Jersey club / Baltimore club",
  "version": "1.0.0",
  "updated": "2026-07-30",
  "case_type": "import",
  "origin": { "region": "US", "scene": "Newark(저지클럽)·Baltimore(볼티모어클럽) 클럽 씬" },
  "adoption_mode": {
    "mode": "full",
    "notes": "앵커 사례 — 발원지 바이럴·빌보드 주류를 거쳐 한국 타이틀 문법으로 전면 수용. 도메인 소유자 증언 중 '빌보드 먼저'는 검증(2022-06/10 → 한국 2022-12), '2021 국내 강세'는 확인 실패(실질 확산 2022 하반기~2023 — 도메인 소유자 인터뷰로 실체 확인 필요)",
    "mode_transitions": []
  },
  "trajectory": [
    { "cell": "origin-scene", "date": "1999~2002", "date_precision": "range", "evidence": "DJ Tameil, Dat Butt EP(2001), Brick Bandits 결성, 'Brick City club' 명명(2002)", "sources": ["https://en.wikipedia.org/wiki/Jersey_club", "https://www.thefader.com/2014/06/12/the-skys-the-limit-an-oral-history-of-jersey-club"], "certainty": "매우 높음", "certainty_note": "씬 당사자 오럴 히스토리 1차급 + 위키 교차" },
    { "cell": "origin-scene-online", "date": "2010~2014", "date_precision": "range", "evidence": "사운드클라우드 재부상, Cashmere Cat 등 리듬 차용 — '씬 음악'에서 '리듬 템플릿'으로 분리", "sources": ["https://en.wikipedia.org/wiki/Jersey_club"], "certainty": "높음" },
    { "cell": "origin-viral", "date": "2020-02", "date_precision": "month", "evidence": "Cookiee Kawaii 'Vibe'(발매 2019-03-29) 틱톡 바이럴 5,000만+ — 발매→바이럴 11개월 잠복", "sources": ["https://audiomack.com/cookieekawaii/song/vibe-if-i-back-it-up", "https://www.rollingstone.com/music/music-features/cookiee-kawaii-vibe-tiktok-1043766/"], "certainty": "매우 높음", "certainty_note": "발매 원기록 + Rolling Stone 교차" },
    { "cell": "origin-viral-2nd", "date": "2022-09~2022-11", "date_precision": "range", "evidence": "'Just Wanna Rock' 안무 챌린지 + DJ Smallz 732 리믹스 포맷 확산 — 한국 주류 3개월 전 마지막 경보", "sources": ["https://knowyourmeme.com/memes/lil-uzi-vert-just-wanna-rock-dance"], "certainty": "높음" },
    { "cell": "origin-mainstream", "date": "2022-06", "date_precision": "month", "evidence": "Drake Honestly, Nevermind 빌보드 200 1위(2022-06-17)·'Sticky' Hot 100 톱20 → Lil Uzi Vert 'Just Wanna Rock'(2022-10) Hot 100 10위", "sources": ["https://en.wikipedia.org/wiki/Honestly,_Nevermind", "https://en.wikipedia.org/wiki/Just_Wanna_Rock"], "certainty": "매우 높음", "certainty_note": "빌보드 차트 원기록" },
    { "cell": "kr-underground", "date": "2020-09", "date_precision": "month", "evidence": "XUM 'DDALALA'(2020-09-24) — '저지클럽 기반' 공식 명시, 단 고립 사례(무실적·해체). 연속 흐름은 2022 하반기(EK·수퍼비 등은 나무위키 단독이라 근거 사용 금지)", "sources": ["https://kstationtv.com/2020/09/30/xum-attention-is-on-girls/?lang=en"], "certainty": "높음" },
    { "cell": "kr-viral", "date": "2022-12~2023-01", "date_precision": "range", "evidence": "'Ditto'·'OMG' 챌린지(창빈 발 2023-01), 국내 틱톡 사용량 수치는 미확보", "sources": ["https://www.koreaboo.com/news/stray-kids-newjeans-changbin-omg-omma-viral-trend-challenge-tiktok/"], "certainty": "중간" },
    { "cell": "kr-mainstream", "date": "2022-12", "date_precision": "month", "evidence": "NewJeans 'Ditto'(2022-12-19, 볼티모어클럽) 멜론 주간 14주 1위·써클 13주 1위·2023 써클 연간 1위", "sources": ["https://en.wikipedia.org/wiki/Ditto_(song)"], "certainty": "높음", "certainty_note": "멜론 원기록 미접근·2차 인용 — 원자료 대조 시 매우 높음 승격 가능" }
  ],
  "leadtimes": [
    { "from_cell": "origin-scene", "to_cell": "origin-viral", "months": 216, "note": "약 18년 잠복(사운드클라우드 중간 단계 포함)" },
    { "from_cell": "origin-viral", "to_cell": "kr-mainstream", "months": 34 },
    { "from_cell": "origin-viral-2nd", "to_cell": "kr-mainstream", "months": 2, "months_range": "1~3", "note": "실질 트리거 기준 — 극도로 짧음" },
    { "from_cell": "origin-mainstream", "to_cell": "kr-mainstream", "months": 4, "months_range": "2~6", "note": "'빌보드 먼저' 검증 구간. 단 Ditto 기획 시점 역산 시 빌보드 확정 전 제작 완료 추정 — 빌보드는 확증 신호지 조기 신호가 아님" },
    { "from_cell": "kr-mainstream", "to_cell": "kr-industry-saturation", "months": 5, "months_range": "4~7", "note": "업계 전면 확산(2023-04~07 세븐틴·르세라핌·뉴진스 3연타)" }
  ],
  "early_signals": [
    { "source_type": "shortform-viral", "date": "2020-02", "lead_months_vs_kr_mainstream": 34, "evidence": "'Vibe' 바이럴 — 저지클럽 비트와 숏폼 챌린지 문법의 구조적 궁합 첫 대규모 증거", "certainty": "매우 높음" },
    { "source_type": "kr-underground-adoption", "date": "2020-09", "lead_months_vs_kr_mainstream": 27, "evidence": "XUM 보도자료에 장르명 등장 — 실행력 부족으로 불발했으나 장르명의 국내 상륙 신호", "certainty": "높음" },
    { "source_type": "kr-underground-adoption", "date": "2020~2022", "lead_months_vs_kr_mainstream": null, "evidence": "국내외 볼룸/보깅 씬의 저지클럽 BGM 정착 — 주류보다 수년 앞선 노출", "certainty": "낮음" },
    { "source_type": "overseas-chart", "date": "2022-06", "lead_months_vs_kr_mainstream": 6, "evidence": "Drake 앨범 1위 — 최상위 아티스트의 장르 승인", "certainty": "매우 높음" },
    { "source_type": "producer-credit", "date": "2022-07", "lead_months_vs_kr_mainstream": 5, "evidence": "뉴진스 데뷔 EP의 250·FRNK 크레딧 — 언더 일렉트로닉 출신의 대형 신인 총괄, 후속 장르 실험의 예고", "certainty": "높음" },
    { "source_type": "shortform-viral", "date": "2022-09", "lead_months_vs_kr_mainstream": 3, "evidence": "'Just Wanna Rock' 챌린지 — 마지막 경보", "certainty": "높음" }
  ],
  "element_borrowing": null,
  "identity_formation": null,
  "signature": {
    "status": "partially-locked",
    "predicted_axes": ["rhythm: kick 5연타(쿵쿵-쿵쿵쿵)·트리플렛 변주", "tempo_bpm 135~160", "baltimore: 에어혼·드럼 브레이크"],
    "locks": ["stem-separation: 하프타임 스네어 판별(승인 대기)", "grid-32: 하이햇 롤(스템과 별개, 격자 해상도)"]
  },
  "peak_decline": {
    "kr_peak": "2023 상반기~3분기 (2023 써클 연간 상위 5곡 중 3곡이 뉴진스)",
    "kr_decline": "2024~ 트렌드 주도자 이탈, '전위'→'관습'(신인 데뷔 공식) 전환 — 플래토 국면",
    "decline_certainty": "매우 낮음",
    "origin_decoupled": false,
    "residue": "신인 데뷔 공식·리듬 어휘로 잔존(izna 2024-11~)"
  },
  "limits": [
    "'2021 국내 강세' 증언 확인 실패 — 도메인 소유자 인터뷰 필요(차트 밖 씬 관측 가능성)",
    "국내 틱톡 사용량·클럽 셋 정량 아카이브 부재 — 모니터 설계의 최대 갭",
    "EK·수퍼비 발매월 나무위키 단독 — 근거 사용 금지",
    "'Smoke' 장르 귀속 매우 낮음(벅스 공식 표기는 랩/힙합)",
    "당시 국내 A&R 내부 인지 시점은 공개 자료로 재구성 불가"
  ],
  "casebook_ref": "CASE 1"
}
